keyword,source,trend_score,error
whatsapp automation tool india,autocomplete,,
ui automation jobs,autocomplete,,
free whatsapp automation app,autocomplete,,
whatsapp automation cheap,autocomplete,,
free whatsapp chat automation,autocomplete,,
how to get whatsapp automation,autocomplete,,
best whatsapp automation software,autocomplete,,
how to make whatsapp automation,autocomplete,,
whatsapp automation course free download,autocomplete,,
how to automate whatsapp business,autocomplete,,
how to do whatsapp automation,autocomplete,,
how to automate whatsapp message,autocomplete,,
what is rpa certification,autocomplete,,
whatsapp automation tool free,autocomplete,,
whatsapp automation app,autocomplete,,
whatsapp business automation software,autocomplete,,
whatsapp automation jobs,autocomplete,,
how to set whatsapp automation,autocomplete,,
what is whatsapp automation course,autocomplete,,
free whatsapp automation bot,autocomplete,,
automation course duration,autocomplete,,
best free whatsapp automation tool,autocomplete,,
automation salary,autocomplete,,
ai automation jobs,autocomplete,,
cheapest whatsapp automation,autocomplete,,
whatsapp automation,autocomplete,,
whatsapp automation companies in india,autocomplete,,
what is whatsapp business automation,autocomplete,,
whatsapp marketing automation software,autocomplete,,
whatsapp automation course on selar,autocomplete,,
whatsapp automation tool github,autocomplete,,
workflow automation jobs,autocomplete,,
whatsapp automation tool open source,autocomplete,,
which certification is best for automation testing,autocomplete,,
what is whatsapp automation tool,autocomplete,,
is there any certification for automation testing,autocomplete,,
whatsapp web automation extension,autocomplete,,
what is automation course,autocomplete,,
whatsapp automation tool free download,autocomplete,,
whatsapp automation course free,autocomplete,,
top 5 automation companies,autocomplete,,
whatsapp automation tool ad,autocomplete,,
whatsapp automation message,autocomplete,,
whatsapp web automation scripts,autocomplete,,
free whatsapp automated messages,autocomplete,,
robot automation companies,autocomplete,,
whatsapp web automation selenium,autocomplete,,
whatsapp automation tools free,autocomplete,,
whatsapp web automation python,autocomplete,,
top 10 whatsapp automation software,autocomplete,,
whatsapp automation free reddit,autocomplete,,
best automatic whatsapp call recorder,autocomplete,,
how to create whatsapp automation,autocomplete,,
how to build whatsapp automation,autocomplete,,
whatsapp automation tool,autocomplete,,
top 10 whatsapp automation software in india,autocomplete,,
whatsapp automation api,autocomplete,,
best whatsapp automation tool,autocomplete,,
whatsapp automation course pdf,autocomplete,,
how to use whatsapp automation,autocomplete,,
whatsapp web automation using python,autocomplete,,
which is best whatsapp or whatsapp business,autocomplete,,
workflow automation companies,autocomplete,,
whatsapp automation services,autocomplete,,
best whatsapp automation tool free,autocomplete,,
web whatsapp automation,autocomplete,,
whatsapp business automation course,autocomplete,,
keus automation careers,autocomplete,,
whatsapp web automation github,autocomplete,,
how to setup whatsapp automation,autocomplete,,
how to automate whatsapp messages,autocomplete,,
whatsapp automation program,autocomplete,,
what flow whatsapp automation,autocomplete,,
whatsapp automation for business,autocomplete,,
free whatsapp automation tool,autocomplete,,
does whatsapp still use erlang,autocomplete,,
how to start whatsapp automation,autocomplete,,
rpa automation jobs,autocomplete,,
whatsapp marketing and automation course,autocomplete,,
whatsapp automation tool reddit,autocomplete,,
what is whatsapp automation,autocomplete,,
software automation salary,autocomplete,,
whatsapp automation free download,autocomplete,,
how to automate whatsapp,autocomplete,,
best whatsapp automation,autocomplete,,
whatsapp automation course,autocomplete,,
rpa automation salary,autocomplete,,
whatsapp automation tools for business,autocomplete,,
jsat automation careers,autocomplete,,
best whatsapp automation app,autocomplete,,
what is automation training,autocomplete,,
whatsapp automation earnings,autocomplete,,
applied automation jobs,autocomplete,,
top whatsapp automation tools,autocomplete,,
what is the best whatsapp automation tool,autocomplete,,
whatsapp automation software free,autocomplete,,
whatsapp automation training,autocomplete,,
whatsapp automation free,autocomplete,,
