keyword,source,trend_score,error
what is ai automation,autocomplete,,
whatsapp ai chat automation swiftchats module,autocomplete,,
whatsapp automation ai tool,autocomplete,,
whatsapp marketing automation software,autocomplete,,
best whatsapp automation software,autocomplete,,
whatsapp ai chat automation,autocomplete,,
top 10 whatsapp automation software,autocomplete,,
whatsapp automation tools for business,autocomplete,,
use of ai in automation,autocomplete,,
whatsapp automation tools free,autocomplete,,
whatsapp automation software,autocomplete,,
ai automation examples,autocomplete,,
whatsapp automation software free,autocomplete,,
ai automation whatsapp group,autocomplete,,
whatsapp automation program,autocomplete,,
whatsapp ai automation,autocomplete,,
whatsapp business ai automation,autocomplete,,
whatsapp business automation software,autocomplete,,
whatsapp automation tools,autocomplete,,
is ai part of automation,autocomplete,,
